results/resumo_geral.csv

scenario,profile,users,repeticoes,tempo_medio_ms,tempo_medio_dp,p95_ms,vazao_rps,total_req,falhas_pct
A,escrita,30,10,20.973000000000003,0.4979970995007006,39.6,17.873611111111114,6434.5,0.0
A,leitura,30,10,15.026,0.37541680540138034,27.9,18.995277777777776,6838.3,0.0
B,escrita,80,10,55.283,1.4187400513601256,132.2,43.651666666666664,15714.6,0.0
B,leitura,80,10,41.11,0.8500588214941374,98.2,49.408055555555556,17786.9,0.0
C,escrita,150,10,193.10899999999998,5.920132224499342,607.7,65.14805555555556,23453.3,0.3667684356736084
C,leitura,150,10,139.92200000000003,3.925536905953121,440.2,74.73055555555555,26903.0,0.03975667142575155

results/fatos_para_analise.md

### 6.2. Qual perfil apresenta maior vazão?

- Cenário A (30 u) / Perfil 2 (Escrita): **17.87 req/s** (6434 requisições na janela medida)
- Cenário A (30 u) / Perfil 1 (Leitura): **19.00 req/s** (6838 requisições na janela medida)
- Cenário B (80 u) / Perfil 2 (Escrita): **43.65 req/s** (15714 requisições na janela medida)
- Cenário B (80 u) / Perfil 1 (Leitura): **49.41 req/s** (17786 requisições na janela medida)
- Cenário C (150 u) / Perfil 2 (Escrita): **65.15 req/s** (23453 requisições na janela medida)
- Cenário C (150 u) / Perfil 1 (Leitura): **74.73 req/s** (26903 requisições na janela medida)